Title;Release Year;Locations;Fun Facts;Production Company;Distributor;Director;Writer;Actor 1;Actor 2;Actor 3;lat;lag
Etruscan Smile;2017;San Francisco UCSF Mt Zion 1600 Divisadero;;Po Valley Productions, LLC;TBD;Oded Binnun/ Michel Brezis;Sarah Bellwood, Michal Lali Kagan, Michael McGowan Amital Stern, Jose Luis Sampedro;Brian Cox;Roseanne Arquette;Thora Birch;37,7850048;-122,4389555
Etruscan Smile;2017;San Francisco 343 Union Street;;Po Valley Productions, LLC;TBD;Oded Binnun/ Michel Brezis;Sarah Bellwood, Michal Lali Kagan, Michael McGowan Amital Stern, Jose Luis Sampedro;Brian Cox;Roseanne Arquette;Thora Birch;37,8007987;-122,40507
Etruscan Smile;2017;San Francisco Pier 39 San Francisco;;Po Valley Productions, LLC;TBD;Oded Binnun/ Michel Brezis;Sarah Bellwood, Michal Lali Kagan, Michael McGowan Amital Stern, Jose Luis Sampedro;Brian Cox;Roseanne Arquette;Thora Birch;37,808673;-122,409821
Etruscan Smile;2017;San Francisco Pier 14 San Francisco;;Po Valley Productions, LLC;TBD;Oded Binnun/ Michel Brezis;Sarah Bellwood, Michal Lali Kagan, Michael McGowan Amital Stern, Jose Luis Sampedro;Brian Cox;Roseanne Arquette;Thora Birch;37,794042;-122,3905325
Etruscan Smile;2017;San Francisco Chaya / Perry's 132 Embarcadero;;Po Valley Productions, LLC;TBD;Oded Binnun/ Michel Brezis;Sarah Bellwood, Michal Lali Kagan, Michael McGowan Amital Stern, Jose Luis Sampedro;Brian Cox;Roseanne Arquette;Thora Birch;37,7930111;-122,3920382
Etruscan Smile;2017;San Francisco Castle Street @ Green Street;;Po Valley Productions, LLC;TBD;Oded Binnun/ Michel Brezis;Sarah Bellwood, Michal Lali Kagan, Michael McGowan Amital Stern, Jose Luis Sampedro;Brian Cox;Roseanne Arquette;Thora Birch;37,8000109;-122,4050755
Etruscan Smile;2017;San Francisco 1227 Montgomery Street;;Po Valley Productions, LLC;TBD;Oded Binnun/ Michel Brezis;Sarah Bellwood, Michal Lali Kagan, Michael McGowan Amital Stern, Jose Luis Sampedro;Brian Cox;Roseanne Arquette;Thora Birch;37,8004781;-122,404539
Etruscan Smile;2017;San Francisco San Francisco City Hall;The museum party interiors were shot in the Historic San Francisco City Hall.;Po Valley Productions, LLC;TBD;Oded Binnun/ Michel Brezis;Sarah Bellwood, Michal Lali Kagan, Michael McGowan Amital Stern, Jose Luis Sampedro;Brian Cox;Roseanne Arquette;Thora Birch;37,7792597;-122,4192646
Etruscan Smile;2017;San Francisco San Francisco Airport;;Po Valley Productions, LLC;TBD;Oded Binnun/ Michel Brezis;Sarah Bellwood, Michal Lali Kagan, Michael McGowan Amital Stern, Jose Luis Sampedro;Brian Cox;Roseanne Arquette;Thora Birch;37,6213129;-122,3789554
Etruscan Smile;2017;San Francisco Benu Restaurant, 22 Hawthorne Street;;Po Valley Productions, LLC;TBD;Oded Binnun/ Michel Brezis;Sarah Bellwood, Michal Lali Kagan, Michael McGowan Amital Stern, Jose Luis Sampedro;Brian Cox;Roseanne Arquette;Thora Birch;37,785452;-122,399036
Etruscan Smile;2017;San Francisco California Street between Front and Davis;;Po Valley Productions, LLC;TBD;Oded Binnun/ Michel Brezis;Sarah Bellwood, Michal Lali Kagan, Michael McGowan Amital Stern, Jose Luis Sampedro;Brian Cox;Roseanne Arquette;Thora Birch;37,7683574;-122,4345272
Etruscan Smile;2017;San Francisco Jones @ Broadway;;Po Valley Productions, LLC;TBD;Oded Binnun/ Michel Brezis;Sarah Bellwood, Michal Lali Kagan, Michael McGowan Amital Stern, Jose Luis Sampedro;Brian Cox;Roseanne Arquette;Thora Birch;37,7968072;-122,4152099
Etruscan Smile;2017;San Francisco Bentley Reserve, 301 Battery Street;The Bentley Reserve is the former San Francisco Federal Reserve. Designed by architect George W. Kelham and completed in 1924, the building has been a prominent landmark of the Financial District for 89 years.;Po Valley Productions, LLC;TBD;Oded Binnun/ Michel Brezis;Sarah Bellwood, Michal Lali Kagan, Michael McGowan Amital Stern, Jose Luis Sampedro;Brian Cox;Roseanne Arquette;Thora Birch;37,7943448;-122,4006632
Etruscan Smile;2017;San Francisco St Regis Hotel, 125 3rd Street;;Po Valley Productions, LLC;TBD;Oded Binnun/ Michel Brezis;Sarah Bellwood, Michal Lali Kagan, Michael McGowan Amital Stern, Jose Luis Sampedro;Brian Cox;Roseanne Arquette;Thora Birch;37,78596;-122,4014544
Etruscan Smile;2017;San Francisco Marriott Marquis, 780 Mission Street;The Marriott Marquis opened on October 17, 1989, the day of the Loma Prieta earthquake.[7] With better earthquake proofing than several nearby hotels, the building only lost a single window.[7];Po Valley Productions, LLC;TBD;Oded Binnun/ Michel Brezis;Sarah Bellwood, Michal Lali Kagan, Michael McGowan Amital Stern, Jose Luis Sampedro;Brian Cox;Roseanne Arquette;Thora Birch;37,7852279;-122,404389
Etruscan Smile;2017;San Francisco Laguna Honda Hospital, 375 Laguna Honda Blvd.;;Po Valley Productions, LLC;TBD;Oded Binnun/ Michel Brezis;Sarah Bellwood, Michal Lali Kagan, Michael McGowan Amital Stern, Jose Luis Sampedro;Brian Cox;Roseanne Arquette;Thora Birch;37,747287;-122,4592344
Etruscan Smile;2017;San Francisco Turk Street between Mason & Leavenworth;;Po Valley Productions, LLC;TBD;Oded Binnun/ Michel Brezis;Sarah Bellwood, Michal Lali Kagan, Michael McGowan Amital Stern, Jose Luis Sampedro;Brian Cox;Roseanne Arquette;Thora Birch;37,8063178;-122,4297213
Etruscan Smile;2017;San Francisco California Street between Sansome & Davis;;Po Valley Productions, LLC;TBD;Oded Binnun/ Michel Brezis;Sarah Bellwood, Michal Lali Kagan, Michael McGowan Amital Stern, Jose Luis Sampedro;Brian Cox;Roseanne Arquette;Thora Birch;37,8021588;-122,4033628
Etruscan Smile;2017;San Francisco 3rd Street between Market & Harrison;;Po Valley Productions, LLC;TBD;Oded Binnun/ Michel Brezis;Sarah Bellwood, Michal Lali Kagan, Michael McGowan Amital Stern, Jose Luis Sampedro;Brian Cox;Roseanne Arquette;Thora Birch;37,7791813;-122,3931795
Etruscan Smile;2017;San Francisco Mason Street @ Vallejo ;;Po Valley Productions, LLC;TBD;Oded Binnun/ Michel Brezis;Sarah Bellwood, Michal Lali Kagan, Michael McGowan Amital Stern, Jose Luis Sampedro;Brian Cox;Roseanne Arquette;Thora Birch;37,7981761;-122,412118
Etruscan Smile;2017;San Francisco 225 California Street;;Po Valley Productions, LLC;TBD;Oded Binnun/ Michel Brezis;Sarah Bellwood, Michal Lali Kagan, Michael McGowan Amital Stern, Jose Luis Sampedro;Brian Cox;Roseanne Arquette;Thora Birch;37,7930909;-122,3992633
Experiment in Terror;1962;San Francisco George Washington High School (600 32nd Avenue );;Columbia Pictures;Columbia Pictures;Blake Edwards;The Gordons;Glenn Ford;Lee Remick;Stefanie Powers;37,7778259;-122,4918861
Experiment in Terror;1962;San Francisco Wells Fargo Bank (1 California Street, Financial District);;Columbia Pictures;Columbia Pictures;Blake Edwards;The Gordons;Glenn Ford;Lee Remick;Stefanie Powers;37,7933985;-122,3967649
Experiment in Terror;1962;San Francisco The Sea Captain's Chest (Fisherman's Wharf);;Columbia Pictures;Columbia Pictures;Blake Edwards;The Gordons;Glenn Ford;Lee Remick;Stefanie Powers;37,8079996;-122,4177434
Experiment in Terror;1962;San Francisco Sheraton Palace Hotel (2 Montgomery Street, Financial District);The hotel was destroyed in the 1906 earthquake and fire, had to be rebuilt, and was reopened in 1909.;Columbia Pictures;Columbia Pictures;Blake Edwards;The Gordons;Glenn Ford;Lee Remick;Stefanie Powers;37,7881439;-122,4017237
Experiment in Terror;1962;San Francisco Roaring Twenties Nightclub (555 Broadway at Columbus);;Columbia Pictures;Columbia Pictures;Blake Edwards;The Gordons;Glenn Ford;Lee Remick;Stefanie Powers;37,7980446;-122,4064657
Experiment in Terror;1962;San Francisco Candlestick Park;Then Vice President Richard Nixon threw out the first pitch when Candlestick opened in 1960. On August 29, 1966, The Beatles played their last concert for paying fans at Candlestick Park.;Columbia Pictures;Columbia Pictures;Blake Edwards;The Gordons;Glenn Ford;Lee Remick;Stefanie Powers;37,7136933;-122,3796916
Experiment in Terror;1962;San Francisco 2632 Larkin Street at Lombard;;Columbia Pictures;Columbia Pictures;Blake Edwards;The Gordons;Glenn Ford;Lee Remick;Stefanie Powers;37,8017807;-122,4212677
Experiment in Terror;1962;San Francisco 100 St. Germain Avenue;;Columbia Pictures;Columbia Pictures;Blake Edwards;The Gordons;Glenn Ford;Lee Remick;Stefanie Powers;37,7576417;-122,4505057
Experiment in Terror;1962;San Francisco 1 Montgomery Street at Post;;Columbia Pictures;Columbia Pictures;Blake Edwards;The Gordons;Glenn Ford;Lee Remick;Stefanie Powers;37,789205;-122,4034422
Family Plot;1976;San Francisco Grace Cathedral Episcopal Church (1100 California Street);Grace Cathedral Episcopal Church is the West Coast's largest Episcopalian cathedral.;Universal Pictures;Universal Pictures;Alfred Hitchcock;Ernest Lehman;Karen Black;Bruce Dern;Barbara Harris;37,7918581;-122,4134328
Family Plot;1976;San Francisco Fairmont Hotel (950 Mason Street, Nob Hill);In 1945 the Fairmont hosted the United Nations Conference on International Organization as delegates arrived to draft a charter for the organization. The U.S. Secretary of State, Edward Stettinius drafted the charter in the hotel's Garden Room.;Universal Pictures;Universal Pictures;Alfred Hitchcock;Ernest Lehman;Karen Black;Bruce Dern;Barbara Harris;37,7923723;-122,4105611
Family Plot;1976;San Francisco 2230 Sacramento Street;"Called ""1001 Franklin"" in the film.";Universal Pictures;Universal Pictures;Alfred Hitchcock;Ernest Lehman;Karen Black;Bruce Dern;Barbara Harris;37,7905166;-122,4305775
Family Plot;1976;San Francisco Nob Hill;Railroad tycoons like Leland Stanford (founder of Stanford University) lived in Nob Hill at the turn of the 20th Century. The 1906 earthquake completely destroyed Nob Hill, with the exception of the wall that surrounded the mansions of Stanford and his neighbor Mark Hopkins.;Universal Pictures;Universal Pictures;Alfred Hitchcock;Ernest Lehman;Karen Black;Bruce Dern;Barbara Harris;37,793014;-122,416113
Fandom;2004;San Francisco ;;The Digital Golem;Cinequest Distribution;Nicholas Tucker;Nicholas Tucker & Mark Hefti;Mark Hefti;Peter Quintana;;37,7749295;-122,4194155
Fat Man and Little Boy;1989;San Francisco Postcard Row (Alamo Square, Hayes Valley);The 6 Victorian homes across from Alamo Square Park are among the few Victorians to survive the Great Fire.;Paramount Pictures;Paramount Pictures;Roland Joffe;Roland Joffe;Paul Newman;John Cusack;;37,7762593;-122,432758
Fathers' Day;1997;San Francisco ;;Northern Lights Entertainment;Columbia Broadcasting System;Ivan Reitman;Lowell Ganz;Robin Williams;Billy Crystal;;37,7749295;-122,4194155
Fearless;1993;San Francisco 400 Montgomery Street;;Spring Creek Productions;Warner Bros. Pictures;Peter Weir;Rafael Yglesias;Jeff Bridges;Isabella Rosellini;Rosie Perez;37,7931409;-122,4025849
Fearless;1993;San Francisco Folsom Street & Embarcadero;;Spring Creek Productions;Warner Bros. Pictures;Peter Weir;Rafael Yglesias;Jeff Bridges;Isabella Rosellini;Rosie Perez;37,761877;-122,4149987
Fearless;1993;San Francisco Varennes Alley between Filbert and Union;;Spring Creek Productions;Warner Bros. Pictures;Peter Weir;Rafael Yglesias;Jeff Bridges;Isabella Rosellini;Rosie Perez;37,8007402;-122,4068231
Fearless;1993;San Francisco St. Peter & Paul's Church (666 Filbert Street, Washington Square);Though Marilyn Monroe and Joe DiMaggio were not allowed to be married at the Church (DiMaggio had married his first wife at the Church but was divorced), the couple returned to the steps of the Church for photos, following their City Hall nuptials.;Spring Creek Productions;Warner Bros. Pictures;Peter Weir;Rafael Yglesias;Jeff Bridges;Isabella Rosellini;Rosie Perez;37,8013901;-122,4101618
Fearless;1993;San Francisco San Francisco General Hospital Medical Center (1001 Potrero Avenue, Potrero Hill);SF General Hospital is the only Level I Trauma Center serving San Francisco and northern San Mateo County. ;Spring Creek Productions;Warner Bros. Pictures;Peter Weir;Rafael Yglesias;Jeff Bridges;Isabella Rosellini;Rosie Perez;37,7558047;-122,4044432
Fearless;1993;San Francisco Kohl Building (400 Montgomery Street);;Spring Creek Productions;Warner Bros. Pictures;Peter Weir;Rafael Yglesias;Jeff Bridges;Isabella Rosellini;Rosie Perez;37,7931409;-122,4025849
Fearless;1993;San Francisco Bank of America Building (555 California Street);The Bank of America Building was the tallest building on the West Coast from 1969-1972, when it was surpassed by the TransAmerica Pyramid. Today, the Bank of America building is the 5th tallest building on the West Coast.;Spring Creek Productions;Warner Bros. Pictures;Peter Weir;Rafael Yglesias;Jeff Bridges;Isabella Rosellini;Rosie Perez;37,792062;-122,4037148
Fearless;1993;San Francisco 90 Gold Street;;Spring Creek Productions;Warner Bros. Pictures;Peter Weir;Rafael Yglesias;Jeff Bridges;Isabella Rosellini;Rosie Perez;37,7967585;-122,4034713
Fearless;1993;San Francisco 5th and Beale Streets;;Spring Creek Productions;Warner Bros. Pictures;Peter Weir;Rafael Yglesias;Jeff Bridges;Isabella Rosellini;Rosie Perez;37,787683;-122,3917907
Final Analysis;1992;San Francisco Westin St. Francis Hotel (335 Powell Street, Union Square);The hotel was originally supposed to be named the Crocker Hotel, after Charles Founder the railroad magnate who founded it. However, the hotel took the name the St. Francis after one of the earliest Gold Rush hotels. ;Warner Bros. Pictures;Warner Bros. Pictures;Phil Joanou;Robert Berger;Richard Gere;Kim Basinger;;37,7877881;-122,4088321
Final Analysis;1992;San Francisco Public Health Service Hospital (Presidio, Golden Gate National Recreation Area);In 1776, Spain made the Presidio a fortified area. The area was then given to Mexico, but then given to the US in 1848. The 1994 demilitarization of the area in 1994 marked the end of its 219 years of military use.;Warner Bros. Pictures;Warner Bros. Pictures;Phil Joanou;Robert Berger;Richard Gere;Kim Basinger;;37,787751;-122,473285
Final Analysis;1992;San Francisco Presidio, Golden Gate National Recreation Area;In 1776, Spain made the Presidio a fortified area. The area was then given to Mexico, but then given to the US in 1848. The 1994 demilitarization of the area in 1994 marked the end of its 219 years of military use.;Warner Bros. Pictures;Warner Bros. Pictures;Phil Joanou;Robert Berger;Richard Gere;Kim Basinger;;37,7988737;-122,4661937
Final Analysis;1992;San Francisco City Hall;The dome of SF's City Hall is almost a foot taller than that of the US Capitol Building. In 1954, Joe DiMaggio and Marilyn Monroe married at the Beaux Arts-style building.;Warner Bros. Pictures;Warner Bros. Pictures;Phil Joanou;Robert Berger;Richard Gere;Kim Basinger;;37,7792597;-122,4192646
Final Analysis;1992;San Francisco Bix Restaurant (56 Gold Street);;Warner Bros. Pictures;Warner Bros. Pictures;Phil Joanou;Robert Berger;Richard Gere;Kim Basinger;;37,7968712;-122,4029298
Flower Drum Song;1961;San Francisco Golden Gate Bridge;With 23 miles of ladders and 300,000 rivets in each tower, the Golden Gate Bridge was the world's longest span when it opened in 1937.;Fields Productions;Universal Pictures;Henry Koster;Joseph Fields;Nancy Kwan;James Shigeta;Benson Fong;37,8190603;-122,4781232
Flower Drum Song;1961;San Francisco Chinatown;First established in the mid-19th Century, SF's Chinatown is the oldest and largest Chinatown in the US.;Fields Productions;Universal Pictures;Henry Koster;Joseph Fields;Nancy Kwan;James Shigeta;Benson Fong;37,7941378;-122,4077914
Flubber;1997;San Francisco Treasure Island;An artificial island, Treasure Island was created for the 1939 Golden Gate International Exposition, and is named after the novel by Robert Louis Stevenson, a one-time San Francisco resident.;Walt Disney Pictures;Buena Vista Pictures;Les Mayfield;Samuel W. Taylor;Robin Williams;Marcia Gay Harden;;37,8235515;-122,370648
Forrest Gump;1994;San Francisco Palace of Fine Arts (3301 Lyon Street);The original Palace was built for the 1915 Panama-Pacific Exposition, and completely destroyed in 1964. It was rebuilt in 1965.;Paramount Pictures;Paramount Pictures;Robert Zemeckis;Eric Roth;Tom Hanks;Robin Wright;;37,8029577;-122,4491929
Foul Play;1978;San Francisco War Memorial Opera House (401 Van Ness Avenue);In 1945 the United Nations had its first conference at The War Memorial Opera House.;Paramount Pictures;Paramount Pictures;Colin Higgins;Colin Higgins;Goldie Hawn;Chevy Chase;Burgess Meredith;37,778583;-122,4208774
Foul Play;1978;San Francisco Sutter & Buchannan Streets;;Paramount Pictures;Paramount Pictures;Colin Higgins;Colin Higgins;Goldie Hawn;Chevy Chase;Burgess Meredith;37,7683574;-122,4345272
Foul Play;1978;San Francisco Sutter & Baker Streets;;Paramount Pictures;Paramount Pictures;Colin Higgins;Colin Higgins;Goldie Hawn;Chevy Chase;Burgess Meredith;37,7683574;-122,4345272
Foul Play;1978;San Francisco Sokoji-Soto Zen Buddhist Temple (1691 Laguna Street);;Paramount Pictures;Paramount Pictures;Colin Higgins;Colin Higgins;Goldie Hawn;Chevy Chase;Burgess Meredith;37,78651;-122,428578
Foul Play;1978;San Francisco Sacramento & Hyde Streets (Nob Hill);;Paramount Pictures;Paramount Pictures;Colin Higgins;Colin Higgins;Goldie Hawn;Chevy Chase;Burgess Meredith;38,5802906;-121,5062691
Foul Play;1978;San Francisco Postcard Row (Alamo Square, Hayes Valley);The 6 Victorian homes across from Alamo Square Park are among the few Victorians to survive the Great Fire.;Paramount Pictures;Paramount Pictures;Colin Higgins;Colin Higgins;Goldie Hawn;Chevy Chase;Burgess Meredith;37,7762593;-122,432758
Foul Play;1978;San Francisco Potrero Hill Bathhouse & Feed Co. (199 Mississippi Street);;Paramount Pictures;Paramount Pictures;Colin Higgins;Colin Higgins;Goldie Hawn;Chevy Chase;Burgess Meredith;37,7641206;-122,3945251
Foul Play;1978;San Francisco Octavia & Hayes Streets (Hayes Valley);;Paramount Pictures;Paramount Pictures;Colin Higgins;Colin Higgins;Goldie Hawn;Chevy Chase;Burgess Meredith;37,7879648;-122,4271064
Foul Play;1978;San Francisco Montgomery & Pine Streets (Financial District);;Paramount Pictures;Paramount Pictures;Colin Higgins;Colin Higgins;Goldie Hawn;Chevy Chase;Burgess Meredith;37,7975865;-122,4037614
Foul Play;1978;San Francisco Laguna & Sacramento Streets (Pacific Heights);;Paramount Pictures;Paramount Pictures;Colin Higgins;Colin Higgins;Goldie Hawn;Chevy Chase;Burgess Meredith;37,747287;-122,4592344
Foul Play;1978;San Francisco Hayes Valley Care (601 Laguna Street, Hayes Valley);;Paramount Pictures;Paramount Pictures;Colin Higgins;Colin Higgins;Goldie Hawn;Chevy Chase;Burgess Meredith;37,7767801;-122,4265958
Foul Play;1978;San Francisco Golden Gate & Steiner Streets (Hayes Valley);;Paramount Pictures;Paramount Pictures;Colin Higgins;Colin Higgins;Goldie Hawn;Chevy Chase;Burgess Meredith;37,8199286;-122,4782551
Foul Play;1978;San Francisco Fort Point, Presidio;Built in 1853, Fort Point is the only West Coast fort built by the Union Army. Though the Confederate army planned to attack San Francisco, the commanding Confederate general learned that the war had ended while end route to SF.;Paramount Pictures;Paramount Pictures;Colin Higgins;Colin Higgins;Goldie Hawn;Chevy Chase;Burgess Meredith;37,8106185;-122,4770527
Foul Play;1978;San Francisco Fort Mason (Golden Gate National Recreation Area);Constructed in 1864 as a coastal defense site, Fort Mason went on to serve as an army post for more than 100 years.;Paramount Pictures;Paramount Pictures;Colin Higgins;Colin Higgins;Goldie Hawn;Chevy Chase;Burgess Meredith;37,8055176;-122,4283351
Foul Play;1978;San Francisco Flood Building (870 Market Street);;Paramount Pictures;Paramount Pictures;Colin Higgins;Colin Higgins;Goldie Hawn;Chevy Chase;Burgess Meredith;37,7850231;-122,4070834
Foul Play;1978;San Francisco Fiesta Laundromat (898 S. Van Ness Ave., Mission);;Paramount Pictures;Paramount Pictures;Colin Higgins;Colin Higgins;Goldie Hawn;Chevy Chase;Burgess Meredith;37,7588719;-122,4172704
Foul Play;1978;San Francisco City Hall;The dome of SF's City Hall is almost a foot taller than that of the US Capitol Building. In 1954, Joe DiMaggio and Marilyn Monroe married at the Beaux Arts-style building.;Paramount Pictures;Paramount Pictures;Colin Higgins;Colin Higgins;Goldie Hawn;Chevy Chase;Burgess Meredith;37,7792597;-122,4192646
Foul Play;1978;San Francisco California & Larkin Streets (Nob Hill);;Paramount Pictures;Paramount Pictures;Colin Higgins;Colin Higgins;Goldie Hawn;Chevy Chase;Burgess Meredith;37,7749295;-122,4194155
Foul Play;1978;San Francisco Asian Art Museum (200 Larkin Street, Civic Center);The Dalai Lama opened an exhibition on Wisdom and Compassion at the museum in 1991.;Paramount Pictures;Paramount Pictures;Colin Higgins;Colin Higgins;Goldie Hawn;Chevy Chase;Burgess Meredith;37,7801637;-122,4161985
Foul Play;1978;San Francisco Andrew S. Hallidie Plaza (Market & Powell Streets);;Paramount Pictures;Paramount Pictures;Colin Higgins;Colin Higgins;Goldie Hawn;Chevy Chase;Burgess Meredith;37,7734494;-122,4213231
Foul Play;1978;San Francisco 430 Vallejo Street (Telegraph Hill);;Paramount Pictures;Paramount Pictures;Colin Higgins;Colin Higgins;Goldie Hawn;Chevy Chase;Burgess Meredith;37,7991728;-122,4046428
Foul Play;1978;San Francisco 24th and Castro Streets (Noe Valley);;Paramount Pictures;Paramount Pictures;Colin Higgins;Colin Higgins;Goldie Hawn;Chevy Chase;Burgess Meredith;37,7513079;-122,4341091
Freebie and the Bean;1974;San Francisco Alco Plaza;;Warner Bros. Pictures;American Broadcasting Company ;Richard Rush;Robert Kaufman;Alan Arkin;James Caan;Loretta Swit;37,757815;-122,5076412
Freebie and the Bean;1974;San Francisco Twin Peaks;"The 2nd highest point in SF after Mt. Davidson, Twin Peaks sit at the geographic center of SF. The native Ohlone people called the area ""called the area ?Los Pechos de la Chola? or ""Breasts of the Indian Maiden,"" but in the 19th Century when America took over the area, it was renamed ""Twin Peaks"".";Warner Bros. Pictures;American Broadcasting Company ;Richard Rush;Robert Kaufman;Alan Arkin;James Caan;Loretta Swit;37,7525098;-122,4475683
Freebie and the Bean;1974;San Francisco TransAmerica Pyramid (600 Montgomery Street);The Pyramid was the tallest skyscraper west of the Mississippi from 1972-1974, until it was surpassed by Los Angeles' Aon Center.;Warner Bros. Pictures;American Broadcasting Company ;Richard Rush;Robert Kaufman;Alan Arkin;James Caan;Loretta Swit;37,7951775;-122,4027787
Freebie and the Bean;1974;San Francisco Stockton Tunnel (Stockton Street at Sutter Street);Opened in 1914, the Stockton Tunnel was built to provide North Beach residents access to the thriving downtown area.;Warner Bros. Pictures;American Broadcasting Company ;Richard Rush;Robert Kaufman;Alan Arkin;James Caan;Loretta Swit;37,7901093;-122,4070453
Freebie and the Bean;1974;San Francisco Steinhart Aquarium (California Academy of Sciences, Golden Gate Park);The Steinhart Aquarium is home to over 38,000 animals, which represent more than 900 species.;Warner Bros. Pictures;American Broadcasting Company ;Richard Rush;Robert Kaufman;Alan Arkin;James Caan;Loretta Swit;37,7698293;-122,466105
Freebie and the Bean;1974;San Francisco Potrero Hill;The most crooked street in San Francisco is actually Potrero Hill's Vermont Street between 20th St & 22nd St.;Warner Bros. Pictures;American Broadcasting Company ;Richard Rush;Robert Kaufman;Alan Arkin;James Caan;Loretta Swit;37,7604929;-122,400869
Freebie and the Bean;1974;San Francisco Nob Hill;Railroad tycoons like Leland Stanford (founder of Stanford University) lived in Nob Hill at the turn of the 20th Century. The 1906 earthquake completely destroyed Nob Hill, with the exception of the wall that surrounded the mansions of Stanford and his neighbor Mark Hopkins.;Warner Bros. Pictures;American Broadcasting Company ;Richard Rush;Robert Kaufman;Alan Arkin;James Caan;Loretta Swit;37,793014;-122,416113
Freebie and the Bean;1974;San Francisco Hyatt Regency Hotel (5 Embarcadero Center);;Warner Bros. Pictures;American Broadcasting Company ;Richard Rush;Robert Kaufman;Alan Arkin;James Caan;Loretta Swit;37,794372;-122,395843
Freebie and the Bean;1974;San Francisco Folsom Street (SOMA);;Warner Bros. Pictures;American Broadcasting Company ;Richard Rush;Robert Kaufman;Alan Arkin;James Caan;Loretta Swit;37,7794588;-122,4044588
Freebie and the Bean;1974;San Francisco Fairmont Hotel (950 Mason Street, Nob Hill);In 1945 the Fairmont hosted the United Nations Conference on International Organization as delegates arrived to draft a charter for the organization. The U.S. Secretary of State, Edward Stettinius drafted the charter in the hotel's Garden Room.;Warner Bros. Pictures;American Broadcasting Company ;Richard Rush;Robert Kaufman;Alan Arkin;James Caan;Loretta Swit;37,7923723;-122,4105611
Freebie and the Bean;1974;San Francisco Embarcadero Freeway;;Warner Bros. Pictures;American Broadcasting Company ;Richard Rush;Robert Kaufman;Alan Arkin;James Caan;Loretta Swit;37,7881524;-122,2512872
Freebie and the Bean;1974;San Francisco Candlestick Park (602 Jamestown Ave.);Then Vice President Richard Nixon threw out the first pitch when Candlestick opened in 1960. On August 29, 1966, The Beatles played their last concert for paying fans at Candlestick Park.;Warner Bros. Pictures;American Broadcasting Company ;Richard Rush;Robert Kaufman;Alan Arkin;James Caan;Loretta Swit;37,7135308;-122,3861392
Freebie and the Bean;1974;San Francisco Broadway and Columbus Avenue (North Beach);;Warner Bros. Pictures;American Broadcasting Company ;Richard Rush;Robert Kaufman;Alan Arkin;James Caan;Loretta Swit;37,7978749;-122,4067162
Gentleman Jim;1942;San Francisco The Barbary Coast;The Barbary Coast was a red-light district that was largely destroyed in the 1906 earthquake. Though some of the establishments were rebuilt after the earthquake, an anti-vice campaign put the establishments out of business.;Warner Bros. Pictures;Warner Bros. Pictures;Raoul Walsh;Vincent Lawrence;Errol Flynn;Alexis Smith;Jack Carson;37,781907;-122,4078286
